question,answer
هل هناك نقاط تجمّع عند الطوارئ,نعم، في كل منطقة توجد نقاط تجمع معلمة تساعد في التنظيم والإخلاء عند الحاجة
ما التصرف عند فقدان جواز السفر,بلغ فورا بعثتك أو حملتك، وتوجه إلى مركز الشرطة أو القنصلية لإصدار بلاغ رسمي
ماذا أفعل إذا فقدت أمتعتي,تواصل مع مركز المفقودات في المشاعر، وبلغ الحملة فورا، وغالبا تعاد الأمتعة المفقودة عبرهم
هل يسمح باستخدام الدراجة أو الكرسي الكهربائي,نعم، يسمح بها داخل الحرم وفي الساحات، ويوجد مسارات مخصصة لتسهيل حركتها
هل يوجد خط مباشر للتبليغ عن المفقودين,نعم، ويوفر مركز إرشاد التائهين أرقاما مباشرة، وغالبا تشارك في ذلك وزارة الحج والأمن العام
ما التصرف عند الشعور بضيق نفس مفاجئ,ابتعد عن الزحام فورا، اجلس في مكان جيد التهوية، اطلب المساعدة، واشرب ماء، وإذا استمر الأمر اطلب الإسعاف
هل توجد لافتات إرشادية في المشاعر بلغات مختلفة,نعم، اللافتات مكتوبة بعدة لغات من بينها العربية، الإنجليزية، الأوردو، والإندونيسية، لتسهيل الفهم على الحجاج
ما أهم التطعيمات المطلوبة قبل الحج,التطعيم ضد الحمى الشوكية إلزامي، ويوصى أيضا بتطعيم الإنفلونزا الموسمية ولقاح كورونا
متى يجب أخذ التطعيمات قبل السفر,يفضل أخذها قبل السفر ب إلى يوما لضمان فاعليتها
هل يُمنع من لم يأخذ التطعيم من دخول السعودية,نعم، بعض التطعيمات شرط أساسي للحصول على تأشيرة الحج
ما الاحتياطات الأساسية لتجنب ضربات الشمس,استخدام المظلة، شرب كميات كافية من الماء، وتجنب التعرض المباشر للشمس خاصة وقت الظهيرة
كيف أتعامل مع حالات الإرهاق الحراري,نقل المصاب لمكان مظلل، ترطيبه بالماء، إعطاؤه سوائل، واستدعاء الإسعاف إن لزم
هل يُسمح باستخدام الكمامات في الحرم,نعم، بل ينصح بها في الزحام الشديد لتقليل العدوى التنفسية
ما الأسباب الشائعة للإصابة بالأمراض بين الحجاج,الزحام، الإجهاد، ضعف المناعة، وعدم الاهتمام بالنظافة الشخصية
هل توجد مراكز صحية في المشاعر,نعم، تنتشر مراكز صحية متنقلة وثابتة في منى، مزدلفة، وعرفات
ما التصرف عند الإصابة بارتفاع الحرارة,الراحة، تناول خافض حرارة، الإكثار من السوائل، واستشارة طبيب لو استمرت الحالة
ما الإجراءات الوقائية لمن يعانون من الربو,حمل البخاخ دائما، تجنب الزحام والغبار، واستخدام الكمامة
هل من الضروري حمل حقيبة إسعافات أولية,نعم، يستحسن أن تحتوي على مطهر، لاصق جروح، مسكنات، ومضادات للإسهال
هل يُسمح بالحملات بتوفير طاقم طبي,نعم، وغالبا يكون شرطا للحصول على الترخيص الرسمي للحملة
ما الأدوية الممنوعة على الحاج حملها,الأدوية المخدرة أو المحظورة دوليا دون وصفة طبية
هل يمكن استخدام مزيلات العرق خلال الإحرام,يمنع استخدام ما فيه طيب، ويستبدل بمزيلات عديمة الرائحة
هل الحلاقة تسبب عدوى,إذا لم تستخدم أدوات نظيفة أو لم تعقم جيدا، فقد تنقل أمراضا مثل التهاب الكبد
هل يوجد إسعاف مجاني,نعم، وزارة الصحة السعودية تقدم خدمات إسعاف طارئة مجانية
ما علامات الجفاف التي يجب الانتباه لها,الدوخة، جفاف الفم، قلة التبول، والضعف العام
هل تُوزع مياه مبردة في المشاعر,نعم، تتوفر مياه زمزم ومياه مبردة بكثرة في الحرم والمشاعر
ما النظام الغذائي الأفضل للحاج,وجبات خفيفة، متوازنة، غنية بالسوائل والخضروات، وتجنب الأطعمة المكشوفة
هل هناك دعم خاص لأصحاب الأمراض المزمنة,نعم، توفر وزارة الصحة مراكز خاصة، وينصح بإحضار تقرير طبي وكمية كافية من الأدوية
كيف أقي نفسي من التسمم الغذائي,تناول الطعام من مصادر موثوقة، وتجنب الطعام المكشوف أو الذي بقي فترة طويلة دون تبريد
هل النوم على الأرض ضار صحيًا,قد يسبب آلاما أو التهابات جلدية، لذلك يفضل استخدام فرشة أو طبقة عازلة
هل المشي الطويل يسبب التهابات في القدم,نعم، لذا ينصح بارتداء أحذية مريحة وتهوية القدمين
ما أفضل طريقة لتجنب العدوى التنفسية,لبس الكمامة، غسل اليدين، وتجنب المصافحة قدر الإمكان
هل يمكن لحاج مريض السكري الصيام,يفضل استشارة الطبيب، فقد يعفى منه للحفاظ على حالته الصحية
هل متاح توزيع أقنعة ومواد تعقيم للحجاج,نعم، توزعها بعض الحملات ووزارة الصحة في المشاعر
هل يُسمح بقياس الضغط والسكر في المشاعر,نعم، وتتوفر هذه الخدمات في كثير من المراكز الصحية والمخيمات
هل الأحذية المفتوحة أفضل في الحر,لا، الأفضل ارتداء حذاء مغلق مريح للحماية من الإصابات والحروق الشمسية
كيف أتعامل مع النزلات المعوية في الحج,شرب السوائل، تناول مضادات إسهال عند الحاجة، والتوجه للمركز الصحي إذا استمرت الحالة
هل التدخين يؤثر على قدرة أداء المناسك,نعم، يضعف التنفس ويزيد من خطر الإصابة بالعدوى الصدرية
ما هي المسكنات الآمنة للحجاج,الباراسيتامول والإيبوبروفين، ولكن يفضل عدم الإفراط دون استشارة طبية
هل يمكن الاستحمام أثناء الإحرام,نعم، لكن بدون استخدام صابون معطر أو شامبو معطر
ما التصرف عند ظهور طفح جلدي,استخدام مراهم مضادة للالتهاب، وتجنب التعرق والاحتكاك قدر الإمكان
هل يوفّر الهلال الأحمر تطبيقات إلكترونية,نعم، يوجد تطبيق أسعفني يتيح طلب الإسعاف وتحديد موقع المصاب
كيف أحافظ على نوم صحي خلال أيام الحج,حاول النوم في أوقات ثابتة، وتجنب الأكل الدسم قبل النوم
هل الحاج بحاجة لتأمين صحي,نعم، ويدرج التأمين ضمن تأشيرة الحج الرسمية لتغطية الطوارئ الطبية
هل هناك مخاطر من مشاركة أدوات الحلاقة,نعم، يجب استخدام أدوات خاصة أو مغلفة لمرة واحدة
ما ضرر المشي حافيًا,قد يسبب حروقا في القدم أو إصابات بقطع زجاج أو حجارة
ما التصرف عند التعرض للسعات الشمس,وضع كمادات باردة، استخدام كريمات مرطبة، وشرب الماء بكثرة
هل مسموح بأخذ أدوية بدون وصفة طبية,نعم لبعض الأدوية البسيطة، لكن الأفضل استشارة الطبيب دائما
هل يُنصح بممارسة الرياضة قبل الحج,نعم، لتحسين اللياقة البدنية والاستعداد للمشي الطويل
ما المدة المثالية للمشي اليومي استعدادًا للحج,دقيقة يوميا قبل السفر بشهر على الأقل
هل مرضى القلب يمكنهم الحج,نعم، بشرط استقرار حالتهم واستشارة الطبيب، مع الالتزام بالتعليمات الصحية
ما أهمية حمل بطاقة صحية,تظهر الحالة الصحية، الأمراض المزمنة، والأدوية، ما يسهل إنقاذك وقت الطوارئ
هل يوجد عيادات نسائية في المشاعر,نعم، ضمن مراكز وزارة الصحة لتلبية احتياجات النساء الصحية
ما الحل لو أصبت بإجهاد بدني شديد,الراحة، شرب ماء، تدليك العضلات بلطف، ويمكن استخدام مكملات أملاح فموية
هل المشي على أرض مزدلفة آمن,نعم، لكن يجب الحذر ليلا وارتداء حذاء مناسب لتفادي الانزلاق أو الإصابة
ما التصرف إذا شعرت بدوار مفاجئ,الجلوس فورا، شرب ماء، تنفس عميق، وطلب المساعدة الطبية إن استمر الأمر
هل الاستحمام البارد مفيد في الحر,نعم، يقلل حرارة الجسم وينشط الدورة الدموية
هل جميع الحملات توفر خدمة طبية,يجب أن توفر، لكن ينصح بالتأكد منها مسبقا عند اختيار الحملة
ما أفضل دعاء عند بدء الطواف,بسم الله، والله أكبر، اللهم إيمانا بك، وتصديقا بكتابك، ووفاء بعهدك، واتباعا لسنة نبيك محمد
هل هناك دعاء مخصص بين الركن اليماني والحجر الأسود,نعم، يسن قول ربنا آتنا في الدنيا حسنة، وفي الآخرة حسنة، وقنا عذاب النار
هل لكل شوط من الطواف دعاء خاص,لا، لم يرد عن النبي أدعية خاصة لكل شوط، لكن يجوز الدعاء بما يشاء
هل يجوز قراءة القرآن أثناء الطواف,نعم، لكن الأفضل الانشغال بالدعاء والذكر، وليس التلاوة فقط
ما أفضل الذكر أثناء السعي بين الصفا والمروة,يستحب قول إن الصفا والمروة من شعائر الله عند بداية الشوط، ثم كثرة الدعاء والذكر
هل هناك دعاء مخصوص عند الصعود على الصفا,نعم، يسن قول الله أكبر، الله أكبر، الله أكبر، لا إله إلا الله وحده لا شريك له
هل يكرر الدعاء بين الصفا والمروة,نعم، يستحب الإكثار من الدعاء، ولا حرج في تكرار الأدعية
ما دعاء يوم عرفة المأثور,أفضل الدعاء لا إله إلا الله وحده لا شريك له، له الملك وله الحمد، وهو على كل شيء قدير
هل يُستحب رفع اليدين في الدعاء يوم عرفة,نعم، رفع اليدين من السنة في هذا اليوم العظيم
ما هو أنسب وقت للدعاء يوم عرفة,من بعد الزوال الظهر حتى غروب الشمس
ما دعاء المبيت بمزدلفة,لا يوجد دعاء مخصوص، لكن يكثر من الذكر والدعاء وقراءة القرآن
هل هناك دعاء أثناء التقاط الجمار,لا، لكن يستحب ذكر الله والتكبير عند كل حصاة الله أكبر
ما الدعاء بعد رمي جمرة العقبة,لا يسن الوقوف بعدها، بخلاف الجمرتين الأولى والثانية
هل يوجد دعاء خاص عند المبيت بمنى,لا، لكن يستحب الإكثار من الذكر والدعاء عموما
هل يُستحب الدعاء عند ذبح الهدي,نعم، يقول بسم الله، والله أكبر، اللهم هذا منك ولك، اللهم تقبله مني
هل يجوز الدعاء عند الحلق أو التقصير,نعم، ويسن أن يقول اللهم اغفر لي، وارحمني، واهدني
هل هناك دعاء عند الخروج من منى,لم يرد دعاء محدد، لكن يستحب الدعاء بالقبول والعودة مغفورا له
ما الذكر المشروع بعد رمي الجمرات,يستحب الوقوف والدعاء بعد الجمرة الأولى والثانية، دون الثالثة
هل التكبير أثناء الرمي يُقال مع كل حصاة,نعم، يقول الله أكبر مع كل حصاة يرميها
هل يُفضل ترتيب معين في الدعاء يوم العيد,لا ترتيب محدد، لكن يكثر من التهليل والتكبير والدعاء بما يشاء
ما أفضل ذكر في أيام التشريق,التكبير، والتهليل، والتحميد الله أكبر، الله أكبر، لا إله إلا الله، والله أكبر، الله أكبر، ولله الحمد
هل يجوز الدعاء بكل ما في النفس,نعم، بما لا يحتوي على إثم أو قطيعة رحم
هل الدعاء بلغة غير العربية جائز,نعم، خاصة لمن لا يحسن العربية
هل الأفضل الدعاء من كتاب أم من القلب,الدعاء من القلب أفضل، لكن لا بأس بالاستعانة بكتيب أدعية موثوق
هل الذكر يكون سرًا أم جهرًا,يجوز كلاهما، والأفضل ما يعين على الخشوع
هل يجوز رفع الصوت بالدعاء في الطواف,لا يشرع رفع الصوت المبالغ فيه حتى لا يؤذي غيره
ما الدعاء المشروع عند دخول الحرم,اللهم افتح لي أبواب رحمتك، أو اللهم زد هذا البيت تشريفا وتعظيما
هل الدعاء عند الحجر الأسود مستحب,الأفضل التلبية أو التكبير فقط عند استلامه، لا دعاء خاص
هل دعاء التلبية يُعتبر ذكرًا,نعم، وهو من أعظم الأذكار في الحج لبيك اللهم لبيك
متى يبدأ الحاج التلبية,من الإحرام حتى بداية رمي جمرة العقبة الكبرى
دعاء للثبات عند الزحام,اللهم ثبت أقدامي، ويسر لي المناسك، وادفع عني الضر
ما دعاء دفع الهم في الحج,اللهم لا سهل إلا ما جعلته سهلا، وأنت تجعل الحزن إذا شئت سهلا
دعاء لطلب المغفرة في المشاعر,اللهم اغفر لي ذنبي كله، دقه وجله، سره وعلنه
دعاء لراحة الجسد والتيسير,اللهم أعني على ذكرك وشكرك وحسن عبادتك
دعاء عند التعب في الطواف أو السعي,ربنا لا تؤاخذنا إن نسينا أو أخطأنا، ربنا ولا تحمل علينا إصرا
دعاء للحفظ من الحوادث,اللهم إني أعوذ بك من الحور بعد الكور، ومن فتنة المحيا والممات
دعاء لتحقيق القبول,اللهم اجعل حجي مبرورا، وسعيي مشكورا، وذنبي مغفورا
دعاء للذرية في عرفات,رب اجعلني مقيم الصلاة ومن ذريتي، ربنا وتقبل دعاء
دعاء لنيل الفردوس,اللهم إني أسألك الجنة وما قرب إليها من قول أو عمل
دعاء عند رؤية الكعبة,اللهم زد هذا البيت تشريفا وتعظيما، وزد من شرفه وكرمه من حجه أو اعتمره
هل يجوز الدعاء للنفس والأهل أثناء المناسك,نعم، بل هو من السنن المستحبة
هل يجوز تخصيص دعاء معين لكل موقف,لا يشترط، إلا ما ثبت عن النبي ، والباقي متروك للعبد
هل يجوز كتابة الأدعية وقراءتها في الطواف,نعم، مع عدم إشغال النفس عن الخشوع والتدبر
هل يُستحب الدعاء للحاكم أو الأمة,نعم، الدعاء للمسلمين عامة من آداب الدعاء
هل هناك دعاء للميت في الحج,نعم، يجوز أن يدعو الحاج لأقاربه الأموات بالمغفرة والرحمة
هل يجوز استخدام تطبيقات أدعية,نعم، إن كانت موثوقة وخالية من البدع
ما أفضل وقت يُرجى فيه إجابة الدعاء,يوم عرفة، أثناء الطواف، وبين الأذان والإقامة، وفي السجود
هل هناك دعاء عند توديع البيت الحرام,اللهم لا تجعل هذا آخر العهد ببيتك الحرام، وإن جعلته فاجعلني مرحوما لا محروما
هل يجوز مشاركة الدعاء مع الآخرين بصوت واحد,الأفضل الانفراد بالدعاء، لا الجهر الجماعي
هل كثرة الدعاء في الحج علامة القبول,لا تعرف علامات القبول يقينا، لكن الإقبال على الدعاء علامة خير وصدق نية
متى يُفضل الوصول إلى المطار للسفر إلى الحج,يفضل الوصول قبل موعد الرحلة ب ساعات على الأقل لإنهاء الإجراءات
ما المستندات المطلوبة في المطار للحجاج,جواز السفر، التأشيرة، بطاقة الحاج، تذكرة الطيران، شهادة التطعيم
هل يمكن السفر إلى السعودية بجواز سفر منتهي,لا، يجب أن يكون الجواز ساريا لمدة لا تقل عن أشهر
هل توجد حقائب أو وزن محدد للحجاج,نعم، كل شركة طيران لها وزن محدد غالبا بين كجم، ويفضل التأكد مسبقا
هل يمكن اصطحاب أدوية شخصية,نعم، مع وصفة طبية إن كانت أدوية خاصة أو ممنوعة عالميا
ما الممنوع حمله في حقيبة اليد داخل الطائرة,السوائل فوق مل، الأدوات الحادة، المواد القابلة للاشتعال
هل توجد خدمات خاصة لكبار السن والمعاقين في المطار,نعم، يمكن طلب خدمة الكرسي المتحرك أو المساعدة من شركة الطيران
هل مسموح باصطحاب ماء زمزم من السعودية,نعم، عادة يسمح بعبوة لتر مجانا عبر منافذ معتمدة
هل تأشيرة العمرة تختلف عن تأشيرة الحج,نعم، تأشيرة الحج تصدر في موسم معين ولها ترتيبات خاصة
هل يوجد تطبيق إلكتروني رسمي يساعد في التنقل بالمطار والحج,نعم، مثل تطبيق نسك وتوكلنا واعتمرنا
كيف ينتقل الحاج من المطار إلى مكة أو المدينة,عبر الحافلات الرسمية لحملات الحج، أو سيارات الأجرة المرخصة
هل توجد قطارات بين مكة والمدينة,نعم، قطار الحرمين السريع يربط بين مكة، المدينة، جدة بسرعة عالية
هل وسائل النقل مكيفة ومريحة,نعم، معظم وسائل النقل للحجاج مجهزة بالتكييف والخدمات الأساسية
هل يمكن استخدام التطبيقات مثل أوبر أو كريم,نعم، متوفرة في السعودية، لكن قد تقيد في بعض المناطق خلال موسم الحج
ما الوسيلة المستخدمة للتنقل بين المشاعر (منى - مزدلفة - عرفات),عبر حافلات الحملات أو قطار المشاعر
هل التنقل بين المشاعر مجانًا,ضمن باقة الحج المدفوعة، لا يطلب دفع إضافي
متى تبدأ رحلات قطار المشاعر,من يوم ذي الحجة التروية حتى نهاية الحج
هل هناك خرائط أو تطبيقات لمعرفة طريق المشاعر,نعم، تطبيق خرائط الحج ومكة الذكية توفر إرشادا دقيقا
هل مسموح بالدراجات أو وسائل نقل شخصية,لا، غير مسموح في الحج لأسباب تنظيمية وأمنية
هل يمكن التنقل لزيارة المدينة بعد انتهاء الحج,نعم، بشرط أن تكون الزيارة ضمن برنامج التأشيرة الخاص بالحاج
ماذا أفعل إذا ضاعت أمتعتي في المطار,التوجه لقسم الأمتعة بالمطار وتقديم بلاغ فورا
ماذا أفعل إذا ضعت في أحد المشاعر,التواصل مع أفراد الأمن أو التوجه لأقرب مركز إرشاد الحجاج
هل يوجد شرطة خاصة بالحجاج,نعم، هناك شرطة الحج والأمن العام مخصصة لخدمة الحجاج
هل أحتاج لحمل جواز السفر طوال الوقت,يفضل حمل صورة فقط، وترك الأصل في مكان آمن
ماذا أفعل إذا فقدت جواز السفر,إبلاغ البعثة الرسمية أو القنصلية فورا لاستخراج بدل فاقد
هل هناك نقاط تفتيش في الطريق بين مكة والمدينة,نعم، لأغراض أمنية وتنظيمية
هل يوجد اتصال مجاني داخل المشاعر,بعض الشركات تقدم شرائح مجانية أو مخفضة للحجاج
هل يتوفر الإنترنت في المشاعر,نعم، تغطية الجيل الرابع متوفرة، لكن قد تضعف في الزحام
هل أحتاج لتفعيل تجوال دولي,ليس ضروريا إذا اشتريت شريحة محلية، وهو الخيار الأرخص غالبا
هل هناك إسعاف أو طوارئ في التنقلات,نعم، سيارات إسعاف مرافقة وأطقم طبية في كل محطة
هل الأفضل السفر ضمن حملة أم بشكل فردي,الأفضل حملة منظمة لتسهيل التنقل والإقامة والمناسك
هل أحتاج بطاقة SIM سعودية,نعم لتسهيل التواصل، وتتوفر في المطار أو الأسواق
هل توجد مواقف للحافلات قريبة من الحرم,نعم، لكن تمنع أحيانا السيارات الخاصة لدواعي التنظيم
هل أحتاج بطاقة خاصة لركوب القطار,نعم، توزع مسبقا ضمن باقات الحملة أو تحجز إلكترونيا
هل يرافقني مرشد في التنقلات,نعم ضمن حملات الحج المعتمدة
متى يُمنع التنقل بين مكة والمدينة,أحيانا في أوقات الذروة التنظيمية خلال الحج
هل يمكن ركوب التاكسي من المشاعر للحرم,غالبا لا يسمح أثناء أيام التشريق، إلا للحالات الخاصة
هل هناك ساعات ذروة في الطريق للمشاعر,نعم، ويفضل التنقل حسب جدول الحملة لتفادي الزحام
هل توفر السعودية مواصلات للحجاج الأفراد,نعم، لكن مع قيود زمنية وأمنية، والأفضل حملة منظمة
هل توجد رسوم على المواصلات,تحسب ضمن رسوم الباقة أو الرحلة مسبقا
هل يمكن الاعتماد على Google Maps في التنقل,مفيد لكنه لا يظهر بعض الحواجز والتنظيمات الأمنية
هل أحتاج إلى تطبيقات ترجمة,مفيد للحجاج غير العرب، مثل
هل توجد أكشاك للاستفسارات في المحطات,نعم، في كل محطة وموقع مشاعر يوجد مركز إرشاد
متى يغلق الطريق إلى عرفات,عادة قبل الزوال بوقت لتنظيم الدخول، حسب تعليمات كل عام
هل يمكنني تغيير وسيلة المواصلات المقررة,نادرا، ويشترط إذن الحملة والمسؤولين
هل هناك متطوعون يساعدون في المطار,نعم، متطوعو سندكم وفرق وزارة الحج في الخدمة
هل يجب تسجيل بياناتي عند الوصول,نعم، تتم رقمنة بيانات الحجاج منذ دخولهم الأراضي المقدسة
هل أحتاج تأمين سفر,التأمين الصحي للحج أصبح إلزاميا ومشمولا في التأشيرة
هل يُسمح بالخروج من الفندق دون تصريح,ينصح بالالتزام بجداول الحملة، خاصة أيام المشاعر
